{
  "v": 1,
  "slug": "dstnzd",
  "generated": "2026-09-25T20:00:00Z",
  "expires": "2026-09-26T20:00:00Z",
  "display": { "name": "Spring Forward", "blurb": "The hour that never happens.", "tz": "Pacific/Auckland" },
  "meeting": { "minutes": 30, "title": "Intro call", "location": null },
  "slots": [
    { "s": "2026-09-25T22:00:00Z", "e": "2026-09-25T22:30:00Z" },
    { "s": "2026-09-26T13:00:00Z", "e": "2026-09-26T13:30:00Z" },
    { "s": "2026-09-26T14:30:00Z", "e": "2026-09-26T15:00:00Z" },
    { "s": "2026-09-26T20:00:00Z", "e": "2026-09-26T20:30:00Z" }
  ]
}
