{
  "v": 1,
  "slug": "dstmdt",
  "generated": "2026-10-31T12:00:00Z",
  "expires": "2026-11-01T12:00:00Z",
  "display": { "name": "Fall Back", "blurb": "The hour that happens twice.", "tz": "America/Denver" },
  "meeting": { "minutes": 30, "title": "Intro call", "location": null },
  "slots": [
    { "s": "2026-10-31T16:00:00Z", "e": "2026-10-31T16:30:00Z" },
    { "s": "2026-11-01T07:00:00Z", "e": "2026-11-01T07:30:00Z" },
    { "s": "2026-11-01T07:30:00Z", "e": "2026-11-01T08:00:00Z" },
    { "s": "2026-11-01T08:00:00Z", "e": "2026-11-01T08:30:00Z" },
    { "s": "2026-11-01T08:30:00Z", "e": "2026-11-01T09:00:00Z" },
    { "s": "2026-11-01T09:00:00Z", "e": "2026-11-01T09:30:00Z" },
    { "s": "2026-11-01T17:00:00Z", "e": "2026-11-01T17:30:00Z" }
  ]
}
